Venue,Region/Country,Published Venue Hire / Package (GBP),Per-Head / Menu From (GBP),Package Name / Type,Pricing Notes,Pricing Source URL(s),Style,Why it fits RL winter brief,Seated Dinner Capacity,Evening/Reception Capacity,Exclusive Use?,Bedrooms Onsite,Nearest Airports,Winter Notes,Website,Comments,Published Venue Hire / Package (USD),Per-Head / Menu From (USD)
"Blenheim Palace, Woodstock, Oxfordshire","Oxfordshire, England","See ‘Price List’ for room_by_room hire (e.g., Long Library, Saloon)",—,Historic State Rooms (dry_hire),Official price list and ‘Prices From’ page outline current bands; exact quote by date & spaces.,https://www.blenheimpalace.com/hospitality/weddings/,Baroque palace & UNESCO World Heritage Site,"State rooms, Long Library ambience; palatial scale for black_tie & champagne.",Multiple spaces (60–300+),Up to 300+; marquees for larger,Venue hire; exclusive options,Limited onsite; nearby hotels in Woodstock/Oxford,LHR; OXF,All_season interiors; winter works beautifully.,https://www.blenheimpalace.com/hospitality/weddings/,,,
"Cornwell Manor, near Chipping Norton, Cotswolds","Oxfordshire/Gloucestershire, England","£35,000 + VAT (3_day weekend, 2026)",—,Exclusive hire (house & gardens; accom. for 24),"Official tariffs list 3_day weekend hire with inclusions; extra nights £4,750 + VAT.",https://cornwellmanor.com/weddings/,Georgian manor & formal gardens,"Portuguese_laurel terraces, ballroom, lakes; quintessential Cotswold chic.",Ballroom up to 100; marquee larger,200+ with marquee,Exclusive_use country house,House bedrooms + cottages (limited),LHR; BHX; OXF,Best spring_autumn outdoors; winter marquee possible with planning.,https://cornwellmanor.com/weddings/,,44450.0,
"Sezincote House, near Moreton_in_Marsh, Cotswolds","Gloucestershire, England",POA (limited summer dates),—,House & gardens (mid_May to mid_Sept),Official site notes 6–9 weddings per year; pricing provided on enquiry.,https://www.sezincote.co.uk/,Mughal_style country house (1805),"Orangery and Persian garden; theatrical, rarefied elegance.",Limited (bespoke; ~80–100 indoors),Larger with marquee (summer focus),Exclusive; very limited dates,No large guest capacity; cottages nearby,LHR; BHX; OXF,Primarily May–Sept; limited weddings per year.,https://www.sezincote.co.uk/weddings-and-events,,,
"Hengrave Hall, Bury St Edmunds, Suffolk","Suffolk, England","From £4,000 + VAT",—,Venue hire (season/day dependent),Official pricing page: exact fee depends on season/day; catering via Milsoms Kesgrave Hall.,https://hengravehall.com/weddings/,16th_century Tudor manor with chapel,"Panelled halls, oratory/chapel, winter_friendly great rooms; classic English romance.",Packages from ~60–150+,200+ evening (site dependent),Exclusive_use; 21 bedrooms,21 bedrooms,STN; LHR,Excellent winter venue; on_site chapel; in_house caterer.,https://hengravehall.com/weddings/,,5080.0,
"Somerley House, Ringwood, Hampshire","Hampshire, England",,,,,https://somerley.com/weddings/,Georgian stately home with Picture Gallery,"Rich interiors, Picture Gallery dining; old_world grandeur for black_tie.",Ceremony/dinner up to ~140,Up to 200; marquee to 250,Exclusive_use,9 bedrooms + cottages,SOU; BOH; LHR,All_season; beautiful winter interiors.,https://somerley.com/weddings/,,,
"North Mymms Park, near Hatfield, Hertfordshire","Hertfordshire, England","£9,000–£10,800 (Mon–Thu); £17,760–£19,800 (Fri–Sun)",—,Exclusive hire (dry-hire),Cvent venue profile lists exclusive_hire bands by day of week.,https://www.northmymms.co.uk/weddings,Elizabethan mansion with Loggia,"Oak_panelled rooms, tapestries; exclusive privacy close to London.",Licensed rooms of varying sizes,200+ with marquee,Exclusive_use,Limited bedrooms; nearby hotels,LTN; LHR,Strong winter capacity indoors.,https://www.northmymms.co.uk/weddings,,11430.0,
"Rushton Hall, Kettering, Northamptonshire","Northamptonshire, England","Exclusive use from ~£9,000–£12,000 (season/month)",—,Exclusive Use (Hotel takeover),Official brochure lists exclusive_use pricing by month; verify exact for your date.,https://www.rushtonhall.com/weddings/,Grade I listed country house hotel,Grand Hall & Orangery; classic English luxury with winter warmth.,60–280 depending on rooms,Up to 500 drinks receptions,Hotel; exclusive use available,50+ bedrooms (hotel),EMA; BHX; LTN,Superb winter facilities; hotel convenience.,https://www.rushtonhall.com/weddings/,,11430.0,
"Carlton Towers, Goole, North Yorkshire","North Yorkshire, England","£6,600–£17,100 (typical range)",—,Exclusive use (stately home),Guides for Brides lists typical pricing and range; venue publishes 2026–27 price guide on request.,https://www.carltontowers.co.uk/weddings/,Gothic Revival stately home,Dramatic state rooms and staircase; candlelit winter feasts; black_tie friendly.,Bespoke (intimate to 200+),200+,Exclusive_use (dry_hire available),Bedrooms onsite (limited),LBA; MAN,Works beautifully in winter; dramatic interiors.,https://www.carltontowers.co.uk/weddings,,8382.0,
"Prestwold Hall, Loughborough, Leicestershire","Leicestershire, England",See 2025 pricing brochure (varies by day/season),—,Exclusive use with in_house catering,Official 2025 pricing brochure available online; confirm current quote for your date.,https://www.prestwold-hall.com/weddings/,Grade I stately home with Library,Library_licensed ceremonies; classic English country_house polish.,Ceremony up to 150 (Library); dining 60–200,Up to ~250,Exclusive_use,Bedrooms onsite + estate cottages,EMA; BHX,Year_round; strong winter interiors.,https://www.prestwold-hall.com/weddings/,,2571.75,
"Syon Park (Great Conservatory & House), Brentford","Middlesex (Greater London), England",,,,,https://syonpark.co.uk/weddings-private-events/,Ducal house with Regency Great Conservatory,State Dining Rooms + glasshouse for receptions; candlelit winter grandeur.,Bespoke (House rooms),200+ (Conservatory),Venue hire; exclusive event timings,No bedrooms (nearby hotels),LHR,Winter parties highlighted by venue; superb interiors.,https://syonpark.co.uk/weddings-private-events/,,,
"Mapperton House & Gardens, near Beaminster, Dorset","Dorset, England",,,,,https://mappertonweddings.com/,Manor house with award_winning gardens,"Warm, intimate house rooms; romantic, old_world charm.",Varies by space; marquee options,200+ with marquee,Exclusive_use day hire,Estate cottages (limited),BOH; SOU; LHR,Winter mainly indoors; check seasonal openings.,https://mappertonweddings.com/,,,
"Belvoir Castle, near Grantham, Leicestershire","Leicestershire, England",POA (packages and exclusive hire),—,Castle weddings (State Dining Room / Lakeside Marquee),Official site describes packages; pricing on application.,https://www.belvoircastle.com/castle-weddings/,Historic ducal castle & state rooms,"Ballroom, Picture Gallery, State Dining Room; aristocratic winter ambience.",Seated up to ~120 (State Dining),Larger receptions across rooms,Exclusive_use,Suites limited (by arrangement),EMA; BHX,All_season venue; candlelit grandeur in winter.,https://www.belvoircastle.com/weddings,,,
"Bovey Castle, Dartmoor National Park, Devon","Devon, England","Winter package from £14,750",—,Winter Wedding Package,Official ‘Winter Weddings’ brochure lists package price; other seasons/pricing on request.,https://www.boveycastle.com/weddings/,Early 20th_century baronial_style hotel,Oak_toned Library & lounges; fireside champagne; country_sport weekend vibe.,Intimate rooms 6–50; larger exclusive,Up to 250 (exclusive),Hotel; exclusive use available,60+ bedrooms (hotel),EXT; BRS,Superb winter setting on Dartmoor; roaring fires.,https://www.boveycastle.com/weddings/,,18732.5,
"Goodnestone Park House, near Canterbury, Kent","Kent, England",,,,,https://goodnestonepark.co.uk/,Georgian country house with gardens,Jane Austen connection; elegant rooms; refined yet intimate.,Bespoke; marquee options,200+ with marquee,Exclusive_use house (12 bedrooms),12 bedrooms (sleeps ~24),LGW; LHR,Winter possible indoors; consider marquee heating if used.,https://goodnestonepark.co.uk/your-wedding/,,,
"Highclere Castle, Newbury, Hampshire","Hampshire, England",POA (very limited dates; up to ~30 for in_castle),—,Exclusive use / marquee reception,Official weddings page: limited availability; contact for bespoke pricing.,https://www.highclerecastle.co.uk/visit-us/celebrate/weddings,Victorian castle (Downton Abbey),State Rooms & Library; intimate winter weddings with dramatic backdrop.,Small/intimate (up to ~30),Receptions to ~150 (private hire),Very limited dates; bespoke,No guest bedrooms (nearby hotels),LHR; SOU,Limited calendar; best in spring/autumn; enquire for winter.,https://www.highclerecastle.co.uk/visit-us/celebrate/weddings,,38.1,
